Campaign,Ad Group,Headline 1,Headline 2,Headline 3,Description 1,Description 2,Final URL,Path 1,Path 2,Ad Status
HotNewsTrends - Trending Topics,Breaking News,Latest Trending News,AI-Powered Updates,Breaking Stories,Get the hottest news stories updated hourly. Fast reliable trending content.,Stay ahead with real-time news updates from our AI-powered newsroom.,https://hotnewstrends.com,trending,news,Enabled
HotNewsTrends - Trending Topics,Breaking News,Hot News Today,Trending Stories,Real-Time Updates,Discover what's trending right now. Breaking news and viral stories updated every hour.,Your source for the latest trending topics and breaking news stories.,https://hotnewstrends.com,hot,stories,Enabled
HotNewsTrends - Trending Topics,Breaking News,Breaking News Now,Viral Stories,Trending Topics,Fast-loading news site with the latest trending topics and breaking stories.,Get instant access to trending news and viral content updated 24/7.,https://hotnewstrends.com,breaking,viral,Enabled
HotNewsTrends - Trending Topics,AI & Tech News,AI News Updates,Tech Trends,Innovation Stories,Latest AI and technology news powered by artificial intelligence.,Cutting-edge tech news and AI developments updated in real-time.,https://hotnewstrends.com,ai,tech,Enabled
HotNewsTrends - Trending Topics,AI & Tech News,Tech Breaking News,AI Journalism,Future Tech,Discover the latest in AI and technology with our automated news platform.,Stay informed about AI breakthroughs and tech innovations as they happen.,https://hotnewstrends.com,technology,innovation,Enabled
HotNewsTrends - Trending Topics,Sports News,Sports Updates,Game Results,Live Scores,Get the latest sports news and game results updated in real-time.,Your go-to source for trending sports stories and breaking game news.,https://hotnewstrends.com,sports,games,Enabled
HotNewsTrends - Trending Topics,Sports News,Game Day News,Sports Trending,Live Updates,Follow trending sports stories and breaking game news as it happens.,Real-time sports updates and trending athletic news coverage.,https://hotnewstrends.com,gameday,scores,Enabled
HotNewsTrends - Trending Topics,Entertainment,Celebrity News,Entertainment,Trending Stars,Latest celebrity news and entertainment stories trending right now.,Your source for viral entertainment news and celebrity trending topics.,https://hotnewstrends.com,celebrity,entertainment,Enabled
HotNewsTrends - Trending Topics,Entertainment,Viral Entertainment,Celebrity Updates,Pop Culture,Discover trending entertainment news and viral celebrity stories.,Stay updated with the hottest entertainment news and pop culture trends.,https://hotnewstrends.com,viral,popculture,Enabled
HotNewsTrends - Trending Topics,Long-tail Keywords,What's Trending,Today's Hot Topics,Viral Stories Now,Find out what's trending today with our AI-powered news platform.,Discover today's hottest trending topics and viral stories in real-time.,https://hotnewstrends.com,whats,trending,Enabled
HotNewsTrends - Trending Topics,Long-tail Keywords,Trending Right Now,Hot Stories Today,Latest Viral News,Get the latest trending stories and viral news updated every hour.,Your source for what's trending right now and breaking viral stories.,https://hotnewstrends.com,rightnow,latest,Enabled
HotNewsTrends - Trending Topics,Mobile & Accessibility,Mobile News App,Fast Loading News,On-the-Go Updates,Fast-loading mobile news with trending topics updated hourly.,Get trending news on your mobile device with lightning-fast loading times.,https://hotnewstrends.com,mobile,fast,Enabled
HotNewsTrends - Trending Topics,Mobile & Accessibility,News On Mobile,Quick News Access,Instant Updates,Access trending news instantly on any device with our mobile-optimized site.,Quick access to trending topics and breaking news optimized for mobile.,https://hotnewstrends.com,quick,instant,Enabled
HotNewsTrends - Trending Topics,News Aggregation,News Aggregator,All Trending Topics,Comprehensive News,Your comprehensive source for all trending topics and breaking news.,Reliable news aggregation with AI-powered content curation and analysis.,https://hotnewstrends.com,aggregator,comprehensive,Enabled
HotNewsTrends - Trending Topics,News Aggregation,Reliable News Source,Trending Analysis,Quality Content,Trusted news source with AI-powered analysis of trending topics.,Get reliable news coverage and trending topic analysis in one place.,https://hotnewstrends.com,reliable,analysis,Enabled
HotNewsTrends - Trending Topics,Trending Current Events,Current Events,Today's Headlines,Breaking Updates,Stay informed about current events and today's most important headlines.,Real-time coverage of current events and breaking news as it develops.,https://hotnewstrends.com,current,headlines,Enabled
